{
  "$schema": "./nutrition-plan.schema.json",
  "meta": {
    "schema_version": "1.0.0",
    "title": "Climbing and rest-day nutrition plan",
    "locale": "en-GB",
    "currency": "GBP",
    "nutrition_data_checked_on": "2026-07-26",
    "source_policy": "Nutrition values are taken from Morrisons UK product pages for the named products.",
    "calculation_policy": "Macros scale linearly from each product's nutrition_basis. Derived values are cached for static rendering but should be regenerated after edits.",
    "important_notes": [
      "Raisins are removed. The climbing-day during-session item is one 42g Nature Valley Oats & Honey wrapper (two bars).",
      "Tofu is the default pasta protein. Chicken is retained only as an optional variant.",
      "Product labels and availability can change; check packaging when accuracy matters.",
      "This is data modelling and arithmetic, not personalised medical or dietetic advice."
    ]
  },
  "nutrient_fields": [
    "energy_kcal",
    "protein_g",
    "carbohydrate_g",
    "fat_g",
    "fibre_g",
    "sugars_g",
    "salt_g"
  ],
  "products": {
    "fage_total_0_950g": {
      "name": "FAGE Total 0% Fat Strained Yoghurt",
      "brand": "FAGE",
      "retailer": "Morrisons UK",
      "pack": {
        "quantity": 950,
        "unit": "g"
      },
      "nutrition_basis": {
        "quantity": 100,
        "unit": "g",
        "state": "as_sold"
      },
      "nutrition": {
        "energy_kcal": 54,
        "protein_g": 10.3,
        "carbohydrate_g": 3.0,
        "fat_g": 0.0,
        "fibre_g": 0.0,
        "sugars_g": 3.0,
        "salt_g": 0.1
      },
      "dietary": [
        "vegetarian",
        "gluten_free"
      ],
      "allergens": [
        "milk"
      ],
      "source": {
        "url": "https://groceries.morrisons.com/products/fage-total-0-fat-strained-yoghurt-950g/112364378",
        "checked_on": "2026-07-26"
      }
    },
    "fuel10k_chocolate_granola_400g": {
      "name": "FUEL10K Chocolate Chunks Protein Granola",
      "brand": "FUEL10K",
      "retailer": "Morrisons UK",
      "pack": {
        "quantity": 400,
        "unit": "g"
      },
      "nutrition_basis": {
        "quantity": 100,
        "unit": "g",
        "state": "as_sold"
      },
      "nutrition": {
        "energy_kcal": 441,
        "protein_g": 15.8,
        "carbohydrate_g": 60.4,
        "fat_g": 13.7,
        "fibre_g": 6.4,
        "sugars_g": 17.5,
        "salt_g": 0.03
      },
      "source": {
        "url": "https://groceries.morrisons.com/products/fuel10k-chocolate-chunks-protein-granola-breakfast-cereal-400g/109120006",
        "checked_on": "2026-07-26"
      }
    },
    "m_organic_clear_honey_340g": {
      "name": "M Organic Squeezy Pure Clear Honey",
      "brand": "Morrisons",
      "retailer": "Morrisons UK",
      "pack": {
        "quantity": 340,
        "unit": "g"
      },
      "nutrition_basis": {
        "quantity": 100,
        "unit": "g",
        "state": "as_sold"
      },
      "nutrition": {
        "energy_kcal": 307,
        "protein_g": 0.4,
        "carbohydrate_g": 76.4,
        "fat_g": 0.0,
        "fibre_g": 0.0,
        "sugars_g": 76.4,
        "salt_g": 0.03
      },
      "source": {
        "url": "https://groceries.morrisons.com/products/m-organic-squeezy-pure-clear-honey-340g/104406291",
        "checked_on": "2026-07-26"
      }
    },
    "fyffes_medium_banana": {
      "name": "Fyffes Premium Banana",
      "brand": "Fyffes",
      "retailer": "Morrisons UK",
      "pack": {
        "quantity": 8,
        "unit": "item"
      },
      "nutrition_basis": {
        "quantity": 1,
        "unit": "medium_banana",
        "state": "edible_portion",
        "approx_weight_g": 80
      },
      "nutrition": {
        "energy_kcal": 72,
        "protein_g": 1.0,
        "carbohydrate_g": 16.0,
        "fat_g": 0.3,
        "fibre_g": 1.1,
        "sugars_g": 14.0,
        "salt_g": 0.05
      },
      "approximate_fields": {
        "fat_g": "Morrisons label reports <0.5g; 0.3g used for calculation.",
        "salt_g": "Morrisons label reports <0.1g; 0.05g used for calculation."
      },
      "source": {
        "url": "https://groceries.morrisons.com/products/morrisons-fyffes-premium-bananas-ripen-at-home/113997003",
        "checked_on": "2026-07-26"
      }
    },
    "yutaka_sushi_rice_500g": {
      "name": "Yutaka Sushi Rice",
      "brand": "Yutaka",
      "retailer": "Morrisons UK",
      "pack": {
        "quantity": 500,
        "unit": "g"
      },
      "nutrition_basis": {
        "quantity": 100,
        "unit": "g",
        "state": "dry_uncooked"
      },
      "nutrition": {
        "energy_kcal": 348,
        "protein_g": 6.3,
        "carbohydrate_g": 79.0,
        "fat_g": 0.5,
        "fibre_g": 1.0,
        "sugars_g": 0.7,
        "salt_g": 0.01
      },
      "source": {
        "url": "https://groceries.morrisons.com/products/yutaka-sushi-rice/105189399",
        "checked_on": "2026-07-26"
      }
    },
    "tofoo_naked_tofu_280g": {
      "name": "The Tofoo Co. Naked Tofu",
      "brand": "The Tofoo Co.",
      "retailer": "Morrisons UK",
      "pack": {
        "quantity": 280,
        "unit": "g"
      },
      "nutrition_basis": {
        "quantity": 100,
        "unit": "g",
        "state": "as_sold"
      },
      "nutrition": {
        "energy_kcal": 145,
        "protein_g": 16.5,
        "carbohydrate_g": 1.1,
        "fat_g": 7.8,
        "fibre_g": 1.9,
        "sugars_g": 0.05,
        "salt_g": 0.06
      },
      "approximate_fields": {
        "sugars_g": "Morrisons label reports <0.1g; 0.05g used for calculation."
      },
      "dietary": [
        "vegan",
        "vegetarian",
        "organic",
        "gluten_free"
      ],
      "allergens": [
        "soya"
      ],
      "source": {
        "url": "https://groceries.morrisons.com/products/the-tofoo-co-naked-tofu-280g/111461045",
        "checked_on": "2026-07-26"
      }
    },
    "morrisons_country_mix_1kg": {
      "name": "Morrisons Country Mix",
      "brand": "Morrisons",
      "retailer": "Morrisons UK",
      "pack": {
        "quantity": 1000,
        "unit": "g"
      },
      "nutrition_basis": {
        "quantity": 100,
        "unit": "g",
        "state": "as_sold_frozen"
      },
      "nutrition": {
        "energy_kcal": 35,
        "protein_g": 2.2,
        "carbohydrate_g": 4.5,
        "fat_g": 0.1,
        "fibre_g": 3.4,
        "sugars_g": 2.9,
        "salt_g": 0.05
      },
      "source": {
        "url": "https://groceries.morrisons.com/products/morrisons-country-mix-1kg/115848466",
        "checked_on": "2026-07-26"
      }
    },
    "kikkoman_less_salt_soy_150ml": {
      "name": "Kikkoman Less Salt Soy Sauce",
      "brand": "Kikkoman",
      "retailer": "Morrisons UK",
      "pack": {
        "quantity": 150,
        "unit": "ml"
      },
      "nutrition_basis": {
        "quantity": 100,
        "unit": "ml",
        "state": "as_sold"
      },
      "nutrition": {
        "energy_kcal": 107,
        "protein_g": 9.7,
        "carbohydrate_g": 6.9,
        "fat_g": 0.0,
        "fibre_g": 0.0,
        "sugars_g": 3.9,
        "salt_g": 9.1
      },
      "allergens": [
        "soya",
        "wheat"
      ],
      "source": {
        "url": "https://groceries.morrisons.com/products/kikkoman-less-salt-soy-sauce/113741331",
        "checked_on": "2026-07-26"
      }
    },
    "morrisons_sunflower_oil_1l": {
      "name": "Morrisons Organic Sunflower Oil",
      "brand": "Morrisons",
      "retailer": "Morrisons UK",
      "pack": {
        "quantity": 1000,
        "unit": "ml"
      },
      "nutrition_basis": {
        "quantity": 100,
        "unit": "ml",
        "state": "as_sold"
      },
      "nutrition": {
        "energy_kcal": 828,
        "protein_g": 0.0,
        "carbohydrate_g": 0.0,
        "fat_g": 92.0,
        "fibre_g": 0.0,
        "sugars_g": 0.0,
        "salt_g": 0.0
      },
      "source": {
        "url": "https://groceries.morrisons.com/products/morrisons-organic-sunflower-oil-1l/114775701",
        "checked_on": "2026-07-26"
      }
    },
    "morrisons_lightly_salted_rice_cake": {
      "name": "Morrisons Lightly Salted Rice Cake",
      "brand": "Morrisons",
      "retailer": "Morrisons UK",
      "pack": {
        "quantity": 100,
        "unit": "g",
        "approx_items": 12.5
      },
      "nutrition_basis": {
        "quantity": 1,
        "unit": "rice_cake",
        "state": "as_sold",
        "approx_weight_g": 8
      },
      "nutrition": {
        "energy_kcal": 30,
        "protein_g": 0.6,
        "carbohydrate_g": 6.1,
        "fat_g": 0.2,
        "fibre_g": 0.3,
        "sugars_g": 0.1,
        "salt_g": 0.06
      },
      "source": {
        "url": "https://groceries.morrisons.com/products/morrisons-lightly-salted-rice-cakes/105404968",
        "checked_on": "2026-07-26"
      }
    },
    "nature_valley_oats_honey_wrapper": {
      "name": "Nature Valley Crunchy Oats & Honey Cereal Bars",
      "brand": "Nature Valley",
      "retailer": "Morrisons UK",
      "pack": {
        "quantity": 5,
        "unit": "wrapper",
        "wrapper_weight_g": 42,
        "bars_per_wrapper": 2
      },
      "nutrition_basis": {
        "quantity": 1,
        "unit": "wrapper",
        "state": "as_sold",
        "weight_g": 42
      },
      "nutrition": {
        "energy_kcal": 196,
        "protein_g": 3.6,
        "carbohydrate_g": 27.0,
        "fat_g": 7.6,
        "fibre_g": 2.7,
        "sugars_g": 11.3,
        "salt_g": 0.36
      },
      "dietary": [
        "vegetarian"
      ],
      "allergens": [
        "oats"
      ],
      "source": {
        "url": "https://groceries.morrisons.com/products/nature-valley-crunchy-oats-honey-cereal-bars/105852082",
        "checked_on": "2026-07-26"
      }
    },
    "morrisons_penne_500g": {
      "name": "Morrisons Penne",
      "brand": "Morrisons",
      "retailer": "Morrisons UK",